{
  "_id": "covid_radx",
  "name": "COVID Rapid Acceleration of Diagnostics (RADx) Data Hub",
  "alternateName": [
    "RADx Data Hub",
    "Rapid Acceleration of Diagnostics Data Hub"
  ],
  "identifier": "radx",
  "url": "https://radxdatahub.nih.gov/",
  "sameAs": "https://data.niaid.nih.gov/resources?id=dde_e1e4d07f1c1b3f00",
  "abstract": "COVID RADx Data Hub is a NIH supported IID repository that includes clinical data.",
  "description": "The NIH Rapid Acceleration of Diagnostics Data Hub (RADx Data Hub) is a centralized data repository that provides access to analytic tools and de-identified COVID-19 data from the RADx Initiative. The RADx Data Hub supports scientific efforts to better understand COVID-19 and factors associated with disparities in morbidity and mortality in underserved and vulnerable populations, by allowing researchers to discover, access, and perform analyses of COVID-19 datasets in a cloud-enabled platform.",
  "collectionType": [
    "Dataset Repository"
  ],
  "genre": [
    "IID",
    "Biological Assay",
    "Clinical",
    "Epidemiological",
    "Omics",
    "Respiratory Pathogens"
  ],
  "conditionsOfAccess": "Restricted",
  "hasAPI": true,
  "creativeWorkStatus": "Accepting Data",
  "schedule": "Manual",
  "schema": {
    "@version": "version",
    "created_at": "dateCreated",
    "ct_url": "isBasedOn.url",
    "data_species": "species.name",
    "dcc": "sdPublisher.name",
    "description": "description",
    "disease_specific_related_conditions": "healthCondition.name",
    "grant_number": "funding.funder.identifier",
    "institution_supporting_study_array": "funding.funder.name",
    "multi_center_sites": "author",
    "pi_name": "author",
    "release_date": "datePublished",
    "publication_url": "citation, funding",
    "source_array": "measurementTechnique.name",
    "types_array": "measurementTechnique.name",
    "data_general_types_array": "measurementTechnique.name",
    "study_id": "url",
    "population_focus_array": "keywords",
    "topics_array": "keywords",
    "study_website_url": "mainEntityOfPage",
    "start_date": "temporalCoverage.startDate",
    "end_date": "temporalCoverage.endDate",
    "subject_array": "variablesMeasured",
    "title": "name",
    "updated_at": "dateModified",
    "general_research_group": "usageInfo",
    "health_biomed_group": "usageInfo"
  }
}
