{
  "_id": "vdj",
  "name": "VDJServer",
  "identifier": "vdjserver",
  "url": "https://vdjserver.org/",
  "sameAs": "https://data.niaid.nih.gov/resources?id=dde_bba1770681743990",
  "abstract": "VDJServer is a NIAID supported repository that includes immune repertoire sequencing data.",
  "description": "VDJServer is a free, scalable resource for performing immune repertoire analysis and sharing data. VDJServer Community Data Portal is part of the AIRR Data Commons. Funded by a National Institute of Allergy and Infectious Diseases research grant (#1R01A1097403), the VDJServer project is led by The University of Texas Southwestern (UTSW) Medical Center in collaboration with the J. Craig Venter Institute and Yale University. The Texas Advanced Computing Center (TACC) at The University of Texas at Austin leads the cyberinfrastructure implementation, including the high performance computing (HPC) systems, storage, and software solutions.",
  "collectionType": [
    "Dataset Repository"
  ],
  "genre": [
    "IID",
    "Omics",
    "General Infectious Diseases and Pathogens"
  ],
  "conditionsOfAccess": "Open",
  "isAccessibleForFree": true,
  "hasAPI": true,
  "creativeWorkStatus": "Accepting Data",
  "schedule": "Weekly",
  "schema": {
    "study.study_id": "identifier",
    "study.study_title": "name",
    "study.study_type.label": "measurementTechnique.name",
    "study.study_type.id": "measurementTechnique.identifier",
    "study.study_description": "description",
    "study.inclusion_exclusion_criteria": "description",
    "study.lab_name": "author.name",
    "study.lab_address": "author.affiliation.name",
    "study.submitted_by": "author.name",
    "study.collected_by": "author.name",
    "study.grants": "description",
    "study.pub_ids": "citation, pmids",
    "study.adc_publish_date": "datePublished",
    "study.adc_update_date": "dateModified",
    "study.publisher": "sdPublisher.name",
    "download_info.archive_file": "distribution.contentUrl",
    "download_info.download_url": "distribution.contentUrl",
    "download_info.file_size": "distribution.contentSize",
    "data_processing.data_processing_files": "distribution.contentUrl",
    "sample.anatomic_site": "keywords",
    "sample.disease_state_sample": "keywords",
    "sample.template_class": "keywords",
    "sample.cell_subset.label": "keywords",
    "sample.tissue.label": "keywords",
    "sample.cell_subset.id": "keywords",
    "sample.tissue.id": "keywords",
    "sample.cell_species.label": "species.name",
    "subject.diagnosis.disease_stage": "keywords",
    "subject.species.id": "species.identifier",
    "subject.species.label": "species.name",
    "subject.diagnosis.disease_diagnosis.label": "healthCondition.name",
    "subject.diagnosis.disease_diagnosis.id": "healthCondition.identifier",
    "assigned based on discussion": "license, usageInfo, conditionsOfAccess, variableMeasured"
  }
}
