{
  "_id": "reframedb",
  "name": "Repurposing, Focused Rescue, and Accelerated Medchem Database (REFRAMEdb)",
  "alternateName": [
    "Repurposing, Focused Rescue, and Accelerated Medchem Database",
    "REFRAMEdb"
  ],
  "identifier": "reframedb",
  "url": "https://reframedb.org/",
  "sameAs": "https://data.niaid.nih.gov/resources?id=dde_f154932b585807e7",
  "abstract": "ReframeDB is a Calibr maintained repository that has a screening set of 12,000 compounds for drug repositioning.",
  "description": "The ReFRAME collection of 12,000 compounds is a best-in-class drug repurposing library containing nearly all small molecules that have reached clinical development or undergone significant preclinical profiling. The purpose of such a screening collection is to enable rapid testing of compounds with demonstrated safety profiles in new indications, such as neglected or rare diseases, where there is less commercial motivation for expensive research and development.",
  "collectionType": [
    "Dataset Repository"
  ],
  "genre": [
    "IID"
  ],
  "conditionsOfAccess": "Restricted",
  "hasAPI": true,
  "schedule": "Weekly",
  "schema": {
    "assay_id": "identifer",
    "assay_title": "name",
    "title_short": "alternateName",
    "authors": "author",
    "summary": "description",
    "purpose": "description",
    "protocol": "description",
    "readout": "description",
    "detection_method": "description",
    "detection_reagents": "description",
    "components": "description",
    "drug_conc": "description",
    "indication": "healthCondition",
    "assay_type": "measurementTechnique",
    "bibliography": "citation"
  }
}
