{
  "_id": "ncbi_pmc",
  "name": "NCBI PMC",
  "identifier": "NCBI PMC",
  "url": "https://www.ncbi.nlm.nih.gov/pmc/",
  "description": "PubMed Central® (PMC) is a free full-text archive of biomedical and life sciences journal literature at the U.S. National Institutes of Health's National Library of Medicine (NIH/NLM). In keeping with NLM's legislative mandate to collect and preserve the biomedical literature, PMC is part of the NLM collection, which also includes NLM's extensive print and licensed electronic journal holdings and supports contemporary biomedical and health care research and practice as well as future scholarship. Available to the public online since 2000, PMC was developed and is maintained by the National Center for Biotechnology Information(NCBI) at NLM.",
  "genre": [
    "Generalist"
  ],
  "conditionsOfAccess": "Unknown",
  "schedule": "Manual",
  "schema": {
    "article-id": "citation.doi",
    "volume": "citation.volume",
    "journal-title": "citation.journalName",
    "pub-date": "citation.datePublished",
    "article-title": "citation.name",
    "abstract": "description",
    "contrib": "author"
  }
}
