{
  "_id": "microbiomedb",
  "name": "MicrobiomeDB",
  "identifier": "microbiomedb",
  "url": "https://microbiomedb.org/",
  "sameAs": "https://data.niaid.nih.gov/resources?id=dde_7f929242375e57cc",
  "abstract": "MicrobiomeDB is a NIAID supported repository that includes clinical microbiome data and analysis tools.",
  "description": "MicrobiomeDB was developed as a discovery tool that empowers researchers to fully leverage their experimental metadata to construct queries that interrogate microbiome datasets.",
  "collectionType": [
    "Dataset Repository"
  ],
  "genre": [
    "IID"
  ],
  "conditionsOfAccess": "Open",
  "hasAPI": true,
  "creativeWorkStatus": "Accepting Data",
  "schedule": "Weekly",
  "schema": {
    "displayName": "name",
    "study_categories": "keywords",
    "type": "keywords",
    "description": "description",
    "institution": "contributor.affiliation",
    "contact": "contributor.name",
    "study_access": "conditionsOfAccess",
    "email": "contributor.email",
    "card_points": "description",
    "card_headline": "doi",
    "summary": "abstract",
    "dataset_id": "identifier",
    "dataset_name": "alternateName",
    "pmids_download": "citation, funding",
    "contacts": "author",
    "DownloadVersion": "distribution",
    "Publications": "citation, funding",
    "AssociatedDatasets": "isPartOf, isRelatedTo",
    "HyperLinks": "url"
  }
}
