{
  "_id": "tycho",
  "name": "Project Tycho",
  "identifier": "tycho",
  "url": "https://www.tycho.pitt.edu/",
  "sameAs": "https://data.niaid.nih.gov/resources?id=dde_76a36925b939cf0e",
  "abstract": "Project TYCHO is a NIH supported IID repository that includes clinical data.",
  "description": "The Project Tycho Repository for Global Health Data aims to advance the availabilty and use of data for improving global health. Project Tycho unlocks global health data to a rapidly growing user community of over 3,000 researchers, students, journalists, officials, and others in over 90 countries. A Project Tycho dataset includes case counts for a disease condition in a country. Data for Project Tycho datasets can come from various sources and have been pre-processed into the standard Project Tycho data format.",
  "collectionType": [
    "Dataset Repository"
  ],
  "genre": [
    "IID",
    "General Infectious Diseases and Pathogens",
    "Epidemiological"
  ],
  "conditionsOfAccess": "Closed",
  "isAccessibleForFree": true,
  "hasAPI": true,
  "schedule": "Weekly",
  "schema": {
    "identifier.identifier": "doi",
    "identifier.identifierSource": "includedInDataCatalog.name",
    "title": "name",
    "description": "description",
    "dates.date": "datePublished, dateModified, dateCreated",
    "storedIn.dates.date": "datePublished, dateModified, dateCreated",
    "storedIn.access.landingPage": "url",
    "storedIn.licenses.identifier.identifier": "license",
    "spatialCoverage": "spatialCoverage",
    "types": "variableMeasured, measurementTechnique",
    "refinement": "keywords",
    "distributions.access.landingPage": "distribution.contentUrl",
    "distributions.access.authorizations.value": "conditionsOfAccess",
    "distributions.formats": "distribution.encodingFormat",
    "creators": "author",
    "licenses.identifier.identifier": "license",
    "acknowledges.funders": "funding.funder",
    "acknowledges.awardees": "author",
    "relatedIdentifiers.identifier.identifier": "isBasedOn.url",
    "dates.type.value": "datePublished, dateModified, dateCreated, temporalCoverage",
    "isAbout": "infectousAgent, healthCondition, variableMeasured"
  }
}
