{
  "_id": "ncbi_virus",
  "name": "NCBI Virus",
  "identifier": "ncbivirus",
  "url": "https://www.ncbi.nlm.nih.gov/labs/virus/vssi/",
  "sameAs": "https://data.niaid.nih.gov/resources?id=dde_b3bb013bc893ca80",
  "abstract": "NCBI Virus is a NIH supported IID repository that includes multiomic data.",
  "description": "NCBI Virus is a community portal for viral sequence data from RefSeq, GenBank and other NCBI repositories.",
  "collectionType": [
    "Knowledge Base",
    "Data Repository"
  ],
  "genre": [
    "Generalist",
    "Omics",
    "General Infectious Diseases and Pathogens"
  ],
  "conditionsOfAccess": "Open",
  "license": "https://creativecommons.org/public-domain/",
  "usageInfo": "http://www.ncbi.nlm.nih.gov/home/about/policies.shtml",
  "inLanguage": "English",
  "isAccessibleForFree": true,
  "hasAPI": false,
  "hasDownload": "All content",
  "creativeWorkStatus": "Accepting Data",
  "schedule": "Manual",
  "schema": {
    "accession": "exampleOfWork.identifier, exampleOfWork.url, hasPart.identifier, hasPart.url",
    "nucleotide.accession_version": "exampleOfWork.identifier, exampleOfWork.url, hasPart.identifier, hasPart.url",
    "nucleotide.sequence_hash": "exampleOfWork.identifier",
    "nucleotide.title": "exampleOfWork.name",
    "virus.tax_id": "_id, identifier, infectiousAgent.identifier, description, url, isBasedOn.target",
    "virus.organism_name": "name, description, infectiousAgent.name, url, isBasedOn.description",
    "virus.common_name": "keywords",
    "virus.pangolin_classification": "keywords",
    "virus.infraspecific_names.strain": "keywords",
    "virus.lineage.name": "exampleOfWork.additionalProperty.Virus lineage.value",
    "virus.lineage.tax_id": "exampleOfWork.additionalProperty.Virus lineage.value",
    "host.tax_id": "species.identifier",
    "host.organism_name": "species.name",
    "host.common_name": "keywords",
    "host.lineage.name": "exampleOfWork.additionalProperty.Host lineage.value",
    "host.lineage.tax_id": "exampleOfWork.additionalProperty.Host lineage.value",
    "host.infraspecific_names.breed": "sample.itemListElement.associatedGenotype, sample.aggregateElement.associatedGenotype",
    "host.infraspecific_names.cultivar": "sample.itemListElement.associatedGenotype, sample.aggregateElement.associatedGenotype",
    "host.infraspecific_names.ecotype": "sample.itemListElement.associatedGenotype, sample.aggregateElement.associatedGenotype",
    "host.infraspecific_names.strain": "sample.itemListElement.associatedGenotype, sample.aggregateElement.associatedGenotype",
    "host.infraspecific_names.sex": "sample.itemListElement.sex, sample.aggregateElement.sex",
    "host.infraspecific_names.isolate": "sample.itemListElement.alternateName, sample.aggregateElement.alternateName",
    "isolate.name": "sample.itemListElement.name, exampleOfWork.name",
    "isolate.source": "sample.itemListElement.sampleType.name, sample.aggregateElement.sampleType.name",
    "isolate.collection_date": "sample.itemListElement.dateCollected, sample.itemListElement.temporalCoverage.startDate, sample.itemListElement.temporalCoverage.endDate, sample.temporalCoverage.startDate, sample.temporalCoverage.endDate",
    "location.geographic_location": "sample.itemListElement.locationOfOrigin.name, sample.locationOfOrigin.name, spatialCoverage.name",
    "location.geographic_region": "sample.itemListElement.locationOfOrigin.name, sample.locationOfOrigin.name, spatialCoverage.name",
    "location.usa_state": "sample.itemListElement.locationOfOrigin.alternateName, sample.locationOfOrigin.alternateName, spatialCoverage.alternateName",
    "biosample": "sample.itemListElement.identifier, sample.itemListElement.url, exampleOfWork.additionalProperty.BioSample.value",
    "biosample.accession": "sample.itemListElement.identifier, sample.itemListElement.url, exampleOfWork.additionalProperty.BioSample.value",
    "biosample.accession_version": "sample.itemListElement.identifier, sample.itemListElement.url, exampleOfWork.additionalProperty.BioSample.value",
    "biosample.identifier": "sample.itemListElement.identifier, sample.itemListElement.url, exampleOfWork.additionalProperty.BioSample.value",
    "bio_sample": "sample.itemListElement.identifier, sample.itemListElement.url, exampleOfWork.additionalProperty.BioSample.value",
    "bio_sample.accession": "sample.itemListElement.identifier, sample.itemListElement.url, exampleOfWork.additionalProperty.BioSample.value",
    "bio_sample.accession_version": "sample.itemListElement.identifier, sample.itemListElement.url, exampleOfWork.additionalProperty.BioSample.value",
    "bio_sample.identifier": "sample.itemListElement.identifier, sample.itemListElement.url, exampleOfWork.additionalProperty.BioSample.value",
    "source_database": "exampleOfWork.isPartOf.name, sdPublisher.name, additionalProperty.Source database distribution.value",
    "mol_type": "sample.itemListElement.sampleType.name, sample.aggregateElement.sampleType.name, exampleOfWork.additionalProperty.Molecule type.value",
    "purpose_of_sampling": "sample.itemListElement.experimentalPurpose, sample.aggregateElement.experimentalPurpose, exampleOfWork.additionalProperty.Purpose of sampling.value",
    "lab_host": "sample.itemListElement.cellType.name, sample.itemListElement.sampleProcess, sample.aggregateElement.cellType.name, sample.aggregateElement.sampleProcess, exampleOfWork.additionalProperty.Lab host.value",
    "completeness": "exampleOfWork.additionalProperty.Completeness.value, additionalProperty.Completeness distribution.value",
    "is_annotated": "exampleOfWork.additionalProperty.Is annotated.value",
    "length": "exampleOfWork.additionalProperty.Sequence length.value",
    "gene_count": "exampleOfWork.additionalProperty.Gene count.value",
    "protein_count": "exampleOfWork.additionalProperty.Protein count.value",
    "mature_peptide_count": "exampleOfWork.additionalProperty.Mature peptide count.value",
    "is_lab_host": "exampleOfWork.additionalProperty.Is lab host.value",
    "is_vaccine_strain": "exampleOfWork.additionalProperty.Is vaccine strain.value",
    "segment": "exampleOfWork.additionalProperty.Segment.value",
    "bioprojects": "exampleOfWork.additionalProperty.BioProject accessions.value, isPartOf.identifier, isPartOf.url",
    "sra_accessions": "exampleOfWork.additionalProperty.SRA accessions.value, hasPart.identifier, hasPart.url",
    "submitter.names": "author.name",
    "submitter.affiliation": "author.affiliation.name",
    "submitter.country": "exampleOfWork.additionalProperty.Submitter country.value",
    "release_date": "dateCreated, datePublished, temporalCoverage.startDate",
    "update_date": "date, dateModified, temporalCoverage.endDate"
  }
}
