{
  "_id": "dbgap",
  "name": "NCBI Database of Genotypes and Phenotypes (NCBI dbGaP)",
  "alternateName": [
    "dbGaP",
    "National Center for Biotechnology Information Database of Genotypes and Phenotypes",
    "NCBI Database of Genotypes and Phenotypes",
    "Database of Genotypes and Phenotypes"
  ],
  "identifier": "dbgap",
  "url": "https://www.ncbi.nlm.nih.gov/gap/",
  "sameAs": "https://data.niaid.nih.gov/resources?id=dde_aceed7f510745d85",
  "abstract": "Database of Genotypes and Phenotypes (dbGaP) is a NIH supported IID repository that includes multiomic data.",
  "description": "The database of Genotypes and Phenotypes (dbGaP) was developed to archive and distribute the data and results from studies that have investigated the interaction of genotype and phenotype in Humans. Such studies include genome-wide association studies, medical sequencing, molecular diagnostic assays, as well as association between genotype and non-clinical traits. The individual level data hosted at the dbGaP is distributed through a controlled access system. The types of data distributed through the dbGaP include phenotype data, association (GWAS) data, summary level analysis data, SRA (Short Read Archive) data, reference alignment (BAM) data, VCF (Variant Call Format) data, expression data, imputed genotype data, image data, etc.",
  "collectionType": [
    "Dataset Repository"
  ],
  "genre": [
    "Generalist",
    "Omics",
    "General Infectious Diseases and Pathogens"
  ],
  "conditionsOfAccess": "Varied",
  "isAccessibleForFree": true,
  "hasAPI": true,
  "creativeWorkStatus": "Accepting Data",
  "schedule": "Manual",
  "schema": {
    "@accession": "identifier",
    "@parentstudy": "isPartOf.identifier",
    "@createdate": "dateCreated",
    "@moddate": "dateModified",
    "attributions": "author, funding",
    "consentgroups.consentgroup.@longname": "usageInfo",
    "description": "description",
    "diseases.disease.@vocab_source": "healthCondition.inDefinedTermSet",
    "diseases.disease.@vocab_term": "healthCondition.name",
    "plaintextdescription": "description",
    "publications.publication.pubmed.@pmid": "citation.pmid",
    "studyhistory": "description",
    "studyinex": "description",
    "studynameentrez": "name",
    "studynamereportpage": "name",
    "studytypes.studytype": "measurementTechnique.name",
    "studyurls.url.@name": "isRelatedTo.name",
    "studyurls.url.@url": "isRelatedTo.url",
    "authorizedaccess.policy.documentset.datausecertificate.@filepath": "license",
    "authorizedaccess.policy.acknowledgementtext.para": "license",
    "authorizedaccess.consentgroups.participantset.irbrequired": "conditionsOfAccess",
    "authorizedaccess.policy.embargolength": "conditionsOfAccess",
    "authorizedaccess.policy.displaypublicsummary": "conditionsOfAccess",
    "displaypublicsummary": "conditionsOfAccess",
    "documents": "isBasedOn"
  }
}
