{
  "_id": "malariagen",
  "name": "Malaria Genomic Epidemiology Network (MalariaGEN)",
  "alternateName": [
    "Malaria Genomic Epidemiology Network",
    "MalariaGEN"
  ],
  "identifier": "malariagen",
  "url": "https://www.malariagen.net/",
  "sameAs": "https://data.niaid.nih.gov/resources?id=dde_c48f8d80237123db",
  "abstract": "Malaria Genomic Epidemiology Network (MalariaGEN) is a IID repository that includes clinical data.",
  "description": "MalariaGEN is an international network of researchers focused on understanding the genetic variations in humans, Plasmodium parasites, and Anopheles mosquitoes to better control malaria transmission. By leveraging advanced genomic tools and techniques, MalariaGEN aims to uncover how genetic differences influence susceptibility to malaria, track insecticide resistance in mosquitoes, and detect drug resistance in parasites. The network's efforts are crucial for developing new interventions and maintaining the effectiveness of existing ones. Coordinated from the Wellcome Sanger Institute in the UK, MalariaGEN collaborates with over 200 partners across more than 40 countries, primarily in malaria-endemic regions.",
  "collectionType": [
    "Dataset Repository"
  ],
  "genre": [
    "IID",
    "Epidemiological",
    "Omics",
    "Arboviruses"
  ],
  "conditionsOfAccess": "Varied",
  "isAccessibleForFree": true,
  "hasAPI": false,
  "creativeWorkStatus": "Accepting Data",
  "schedule": "Weekly",
  "schema": {
    "title": "name",
    "released on": "datePublished",
    "project": "isPartOf",
    "url": "identifier",
    "keywords": "keywords",
    "datasets": "distribution",
    "citations": "citation",
    "data package contact": "author",
    "spatialCoverage": "spatialCoverage"
  }
}
